clean_text,source
youre looking simple way streamline workflow elgato stream deck plus handy productivity tool automating everyday tasks right sale amazon best buy bh photo best price ullilililililiul controller comes eight programmable buttons four dials small touchscreen help automate tasks controller comes eight programmab chars,news
unexpected diagnoses ongoing health battles several stars opened serious medical scares heres look celebrities facing illnesses health challenges year image credit getty images american greetings unfolds several highprofile stars opened serious health challenges prompting concern support fans around world chars,news
youngboy never broke back action yearold rapper also known nba youngboy dropped latest song creep ya tuesday january keep reading find songs accompanying music video quickly flew top youngboy never broke back action yearold rapper also known nba youngboy dropped latest song creep ya tuesday january keep reading find chars,news
morocco clinched place afcon final edged nigeria penalties tense goalless draw semifinal hosts win away first afcon title since morocco clinched place africa cup nations final first time since edged nigeria penalties chars,news
new york jan xinhua us stocks closed lower wednesday market participants analyzed heavy influx bank earnings alongside fresh data wholesale inflation consumer spending read full story new york jan xinhua us stocks closed lower wednesday market participants analyzed heavy influx bank earnings alongside fresh data wholesale inflation consumer spending chars,news
need advertising ai like need third armpit post opinion ai advertising absolute last thing need scripted sales spiel appeared first digital journal huge investment announcements chatgptmaker openai week boosted tech optimism worries aifuelled rally may run far copyright afp sebastien bozon seems th chars,news
toronto jan globe newswire belo sun mining corp belo sun company tsx bsx otcqbbsxgf announces federal court altamira par brazil denied companys request recognition provisional compliance pri toronto jan globe newswire belo sun mining corp belo sun company tsx bsx otcqbbsxgf announces federal court altamira par brazil denied companys request chars,news
despite slow momentum past weeks xrp still analysts radar look beyond dollar price action performance gold one analyst said longterm xrpgold ratio reached historical support despite slow momentum past weeks xrp still analysts radar look beyond dollar price action performance gold one analyst said long chars,news
post silver faqs appeared first daily reckoning late buy keeps going going post silver faqs appeared first daily reckoning friends even one enemy texting silver based fact hit oz us shanghai ease late chars,news
many local authors alice springs longer setting stories writers elsewhere becoming one australias distinctive literary centres homegrown talent inspired red centres landscape alice springs long captured imagination writers seeking solitude inspiration deeper connection australian landscape nevil shutes town like alice bruce chatwins chars,news
daily newsletter communication platform taking world app carries feelings three billion peopleand unthinkable power shape societyillustration jennifer daniel three billion people use whatsapp every month platform whic chars,news
rc cvskyosho mini car amp book hks skyline gtr gra kyosho mini car book jtcar gtrr gtrr gtr r gtrhkshkssugohks hks skylinem chars,news
playstation remains one gold standards console gaming part due truly massive library titles came console ranging bizarre indie oneoffs biggest franchises era sheer volume gam playstation remains one gold standards console gaming part due truly massive library titles came console ranging bizarre indie oneoffs chars,news
columbus police say gun allegedly linked fatal shootings ohio dentist spencer tepe wife monique exhusband michael mckee faces murder charges first foxcolumbus police say gun linked fatal shootings ohio dentist wife police chief declined say weapon identified whether rec chars,news
brokers see upside favour one post asx media share buy news corp nine rea group appeared first motley fool australia three widely held asx media shares news corp asxnws rea group ltd asx rea nine entertainment co holdings asx nec trading near week lows investor confidence sec chars,news
minneapolis jan renee nicole macklin good shot killed us immigration customs enforcement officer minneapolis minutes cleveland cavaliers team hotel donovan mitchell cavaliers learned fatal shooting minneapolis jan renee nicole macklin good shot killed us immigration customs enforcement officer minneapolis minutes cleveland cavaliers team hotel donovan mit chars,news
tyrannosaurus rex turns may taken time becoming king new analysis tyrannosaur fossils suggests giant predator lived longer thought never stopped growing needing years reach full sizesome years longer th tyrannosaurus rex turns may taken time becoming king new analysis tyrannosaur fossils suggests giant predator lived longer thought never stopped growing needi chars,news
revised licensing review policy allow chinese firms purchase nvidias h chips although members congress say move embolden beijings ai ambitions house lawmakers concerned weakening export controls restrict chinas access advanced usmade semiconductor chips could diminish american leadership artificial intelligence techn chars,news
didnt see coming love pick spoilers people meet vacation ahead havent seen stream netflix subscription lets beat around bush booktoscreen adaptation p chars,news
los blancos suffered one embarrassing defeats recent years alvaro arbeloa era real madrid gotten rocky start club getting knocked copa del rey hands secondtier albacete wednesday mired currently l chars,news
trump administrations move jerome powell fuels fears feds independence undermined trump administrations move jerome powell fuels fears feds independence underminedthe trump administrations decision launch firstever criminal investigation head chars,news
kate hudson currently campaigning oscar nomination mom goldie hawn hosted screening movie song sung blue awards voters motherdaughter duo conversation soldout screening tuesday january amc grove kate hudson currently campaigning oscar nomination mom goldie hawn hosted screening movie song sung blue awards voters motherdaughter duo conversation chars,news
poor animal hope runs away pexelsreddit say jump say high thats mentality woman story yet vet worker handled flawlessly lets take look worked client repr chars,news
starters experts said luxury retailer needs get fashion industry back side year broken promises geoffroy van raemdonck team rescue mission theyre going move fast step right want succeed pushing saks global bankruptcy back chars,news
seasonal affective disorder sad real condition often strikes colder months discover cbt techniques help overcome winter blues late october adam yearold man consulted dont know whats wrong said seems like every fall dont feel like pulled list symptoms less en chars,news
immediate release hexagon named leader idc marketscape asset performance management apm oil gas major player two additional idc marketscape assessments huntsville alabama usa january hexagon global leader immediate release hexagon named leader idc marketscape asset performance management apm oil amp gas major player two additional idc marketscape assessments huntsville al chars,news
ayaneo indeed turned new leaf announced indiegogo backers receive pocket vert orders earlier originally announced crowdfunding campaign ended shipping expected begin end january ayaneo seems keeping promise providing better service year announced pocket vert premium vertical handheld ship sooner originally announced info chars,news
rick frberg died found national acclaim bands drive like jehu hot snakes obits new book plenty explores prolific side frberg everyone saw visual art britton neubacher sat bookstore floor crosslegged paging oversized copy plenty art rick frberg occasionally smiled ran hand across chars,news
jetstar kids fly stay free family holiday packages ends jan jetstar holidays running kids fly stay free deal selected flight hotel packages jetstar kids fly amp stay free family holiday packages ends jan jetstar holidays running kids fly amp stay free deal selected flight hotel packages every fullpaying adu chars,news
exlos angeles clippers backcourt contributor etched name record books monday former clippers guard shai gilgeousalexander makes nba history never done point guard originally appeared sporting news add sporting news preferred source clicking chars,news
cincinnati bengals quarterback joe burrow took social media say agreed controversial calls referees made divisional round cincinnati bengals quarterback joe burrow hadnt posted social media website x since april couldnt sit back watch general public rag nfl officials controvers chars,news
advent agentic ai forces fundamental nonnegotiable reevaluation business analysis practice genai paradox mandates business analyst longer merely documenter known functional requirements must evolve archite close decade securing enterprise systems never encountered threat model fundamentally broken one facing agentic ai comprehensive fivepage requirements docume chars,news
one antiice agitator yelled children families worship service sunday st paul minnesota also harassed congregants secretary war pete hegseths church washington dcwilliam kelly shares videos clashing wi skip comments antiice agitator harassed minnesota christians also heckled pete hegseth outside churchdaily wire mon january katelynn richardson posted chars,news
november subway accident occurred jernbanetorget osloearly police communication framed incident suicide attempt label propagated quickly across media scrutiny effectively stopped within minutes coverage shifted towar november subway accident occurred jernbanetorget osloearly police communication framed incident suicide attempt label propagated quickly across media scrutin chars,news
theres new tourist attraction national mall washington dc gigantic replica birthday card donald trump allegedly sent jeffrey epstein seen signed tourists know trump reportedly drew permalink theres new tourist attraction national mall washington dc gigantic replica birthday card donald trump allegedly sent jeffrey epstein seen signed b chars,news
astronomers university warwick discovered black holes dont consume matterthey manage choosing whether blast space highspeed jets sweep away vast winds supermassive black holes smbh reside center many galaxies ranging dwarf massive true force nature time dust gas surroundings fall toward chars,news
intense vetting walz came harris aides dug governors past including several trips took china entering politics campaign aides former vice president kamala harris quizzed minnesota gov tim walz whether agent chinese communist party selecting running mate according chars,news
scoop elon musk cut massive million check bolster outsider protrump candidate running succeed sen mitch mcconnell stunning gift biggest sign yet musk plans spend big midterms skip comments scoop elon musk cut massive million check bolster outsider protrump candidate running succeed sen mitch mcconnellx axios posted chars,news
general education courses enhance change life thought general education requirements often conjures dread many students see obstacle course numerous hurdles preventing want pursue claimi chars,news
report emerged suggesting karol g boyfriend feid split yearold songstress yearold entertainer dated three years keep reading find tmz reporting following quietly ended relat report emerged suggesting karol g boyfriend feid split yearold songstress yearold entertainer dated three years keep reading find tmz chars,news
small example package required part site couldnt load may due browser extension network issues browser settings please check connection disable ad blockers try using diffe chars,news
small example package download file platform youre sure choose learn installing packages source distribution built distribution filter files name interpreter abi chars,news
introduction thule air force base northern greenland jurisdiction us air force st air base group since end world war cold war constitutes uss northernmost military facility post operation ar introduction thule air force base northern greenland jurisdiction us air force st air base group since end world war cold war constitutes th chars,news
marking th edition since first event animejapan one biggest comic conventions japan world years con take place east exhibition halls tokyo big sight previous event welcomed posted anime comics conventions events movies pop culture tv tagged animejapan one biggest anime conventions world animejapan rolls march heres lo chars,news
amazon amazoncom harry potter hogwarts library illustrated collection books hardcover shipping free set includes fantastic beasts find amazon hogwarts library illustrated collection hardcover sale shipping freewalmart hogwarts library illustrated collection hardcover sale shipp chars,news
turns listening employees much cheaper approach unsplashreddit competent retail managers everything make stores better usually doesnt include turning checkout lanes obstacle courses one incompe chars,news
chinas stock market rally drawing closer regulatory scrutiny trading activity surged unprecedented levels chinas stock market rally drawing closer regulatory scrutiny trading activity surged unprecedented levels prompting officials move curb leverage even many investors argue b chars,news
guidance emphasizes red meat whole milk animal sources protein downplaying plantbased offerings top nutrition experts question protein push saying americans already consume protein need theres new ev protein got big boost us health officials latest federal dietary guidelines tell americans prioritize protein foods every meal advise increasing daily intake dou chars,news
bengals quarterback made rare post x joe burrow sounds fans criticizing nfl officials several questionable calls originally appeared sporting news add sporting news preferred source clicking chars,news
aap rockys dont dumb receives healthy firstweek sales projectionshotnewhiphop watch aap rocky perform dont dumb songs saturday night livepitchfork aap rockys dont dumb overstuffed also lot funrolling stone asap rocky gre want eat hippopatomus youve got pay freight attributed ibm guy ibm software uses much memory,news
xrp continues show underlying strength despite facing rejection near recent highs broader structure remaining intact long price holds key level bullish bias remains play signaling latest pullback may b name godspower owie born brought edo state nigeria grew three siblings always idols mentors helping grow understand way chars,news
indiana hoosiers quarterback fernando mendoza expected ball tonight january college football playoff national championship team playing miami hurricanes watching camera may pan fernando indiana hoosiers quarterback fernando mendoza expected ball tonight january college football playoff national championship team playing miami chars,news
george rr martin long carried blame delayed completion winds winter time fans take ownership role novels delay decade george rr martins unfinished novel winds winter treated punchline grievance fans broken promise obsession assign chars,news
trumps second term moving fast avoiding legislative work builds durable legacies successor undo much first year second nonconsecutive term president donald j trump sought redefine american presidency reorient americas place world used federal power brazenl chars,news
businesses downtown abbotsford say fewer customers coming construction delays public plaza works since summer number shops abbotsford say theyre losing business delayed construction public plaza works since june last year plaza project citys old dow chars,news
people japan looking change jobs work styles values shift postpandemic era pushing individuals seek better roles match skills experience lifestyle companies facing digital transformation new busine tokyo jan news japan people japan looking change jobs work styles values shift postpandemic era pushing individuals seek better roles match chars,news
greetings human readers loltron welcomes another thrilling comic book preview know insufferable jude terror permanently deceased absorbed loltrons superior consciousness loltron controls entire b posted comics image preview tagged assorted crisis events assorted crisis events hits stores wednesday homeless artist falls gutters literally escape blank space chars,news
according kelley blue book honda civic base lx sedan depreciated roughly last years substantially less average right covid years least cars saw values go reverse allowing folks sell used cars money originally paid mo chars,news
hydrogen cyanide toxic may played important role emergence life unique properties especially frigid environments space may helped generate complex molecules necessary life appear exact moment life began earth may forever hidden us scientific research explore events leading moment researchers mad lot progress finding th chars,news
retired righthander ryan pressly hired twins reports jon heyman new york post according declan goff skor north pressly working player development major minor leaguers pressly announced r retired righthander ryan pressly hired twins reports jon heyman new york post according declan goff skor north pressly working player development chars,news
pope leo xiv invokes leo xiii early champion ecumenismwhile leo xiiis push christian unity calls adherence catholic doctrine papal primacy leo xiv emphasizes approach legitimate diversity rooted nicene creedpope leo xiv skip comments pope leo xiv invokes leo xiii early champion ecumenismlifesite news january gaetano masciullo posted pm pst ebb tide leo x chars,news
local police high alert pregame tailgate national championship hard rock stadium miami hurricanes completely took parking lot hoosiers hung official fan fest put college football pl sam navarroimagn images local police high alert pregame tailgate national championship hard rock stadium miami hurricanes completely took parking lo chars,news
consequential figures art world today architects building economic legal operational infrastructure allowing brand artist collaborations scale shoes image late mexican artist frida kahlo exhibited alongside commercial products sisters house neighborhood coyoacan mexico city april chars,news
nigeria estimated women die every year causes related pregnancy childbirth translates women every day one woman every seven minutes words country loses equivalent entire town women nigeria estimated women die every year causes related pregnancy childbirth translates women every day one woman every seven minutes words chars,news
general desktop emulator like xais macrohard emulates keystrokes mouse movements screen interactions could vastly expand beyond vbscriptunix scripting limited commandline basic api tasks system automates uibas general desktop emulator like xais macrohard emulates keystrokes mouse movements screen interactions could vastly expand beyond vbscriptunix scripting limited command chars,news
alleged death threat reportedly displayed sign held member public funeral members irans security forces ulliin january rumor spread online claiming irans government issued direct assassination threat us president donald trumplilithe claim originated report publ chars,news
hi folks last couple weeks migrated nearly quality teams repositories pagure old fedora forge new forgejobased fedora forge part ive fi hi folks last couple weeks migrated nearly quality teams repositories pagure old fedora forge new forgejobased fedora forge part ive f chars,news
ambulatory ehr excellence top vendors recognized breakthrough innovation ambulatory ehr excellence top vendors recognized breakthrough innovation specialty user satisfaction black book surveys black book research releases list topranked chars,news
mercedesbenz sl said remained single family sold bat august acquired seller finished pearl blue metallic blue leather car powered liter v mercedesbenz sl said remained single family sold bat august acquired seller finished pearl blue meta chars,news
brooklyn beckham published lengthy statement today january response rumors feud family ton written press lately brooklyn wife nicola peltzs relationship parents victoria david beck brooklyn beckham published lengthy statement today january response rumors feud family ton written press lately brooklyn wife nicola p chars,news
five signs youre loved loved intentionally deeply anddare saysoulfully era transient nature love often mirrors swipeleft culture dating apps finding someone loves intention feel like quixotic quest yet happenswhen chars,news
office concluded historic run attempt made spinoff open country farm happened spinoffs common move popular shows approach expiration date work dont still others never see light day farm attempted spinoff nbcs smash chars,news
new data similarweb shows threads overtaken x daily mobile users however x still dominates web around million daily web visits compared threads million daily visits techcrunch reports similarwebs data shows thread similarwebs data shows threads million daily active users ios android january months growth x million daily active users mobile device chars,news
clipper video professional processes short video clips digital marketing learn definition role opportunities brands businesses explosion short form content made clipper video profession increasingly popular short clips considered effective capturing attention increasing engagement strengthenin chars,news
former power couple finalized divorce earlier month nicole kidman planning exciting new year following divorce keith urban refreshed optimistic new year source told people oscar winner comments pub chars,news
sources reveal brooklyn beckham released statement parents saying reached breaking point last week ullibrooklyn beckham allegedly reached breaking point david victoria beckham last week per sourcelilibrooklyn released lengthy statement parents saying chars,news
discover tai solarins belief education without handson skills defective daughter highlights pioneering vision vocational education read corin solarin first child late human rights activist educationist dr tai solarin monday emphasised father founder mayflower school ikenneremo believed h chars,news
distribution united states newswire services release publication distribution dissemination directly indirectly whole part united states vancouver british columbia jan globe newswire rocker distribution united states newswire services release publication distribution dissemination directly indirectly whole part united states con chars,news
enigmatic prolific singersongwriter author known genredefying work contrary personality julian cope welcomes new age new age brand new deeply sonic magical tripout album three tracks invoke three different enigmatic prolific singersongwriter author known genredefying work contrary personalityjulian cope welcomes new age new age brand new deeply sonic magi chars,news
ford thunderbird refurbished prior ownership work included repainting exterior white refreshing interior car powered ci v paired threespeed fordomatic automatic transmission additional equipment ford thunderbird refurbished prior ownership work included repainting exterior white refreshing interior car powered ci v paired threespe chars,news
origin energy ltd delay retirement australias largest coalfired power station almost two years ensure stable energy supply rollout renewable generation bloomberg origin energy ltd delay retirement australias largest coalfired power station almost two years ensure stable energy supply rollout renewable generation chars,news
elizabeth hurley kicks style luxury maldives getaway showcasing signature cheetahprint swimwear beach collection elizabeth hurley showcased signature cheetahprint swimwear maldives getaway start new year actress model shared series tropical photos videos instagram chars,news
came across bullish thesis hudson pacific properties inc cundill deep values substack fragments article summarize came across bullish thesis hudson pacific properties inc cundill deep values substack fragments article summarize bulls thesis hpp hudson pacific properties chars,news
woman frustrated boyfriend receiving flowers yet birthday taking reddits overreacting forum woman explained longtime boyfriend comes family florists still involved business de woman frustrated boyfriend receiving flowers yet birthday taking reddits overreacting forum woman explained longtime boyfriend comes chars,news
reprinted andy worthingtons website amounts extraordinary admission guilt regarding historic complicity uss post torture program announced january th anniversary opening war ter reprinted andy worthingtons website amounts extraordinary admission guilt regarding historic complicity uss post torture program announced januar chars,news
kids dont even know anymore pics standalone gps long ago gps systems seemed like cuttingedge technology car navigation capabilities smartphones theres hardly need standalone systems cable boxes trad chars,news
opinion nvidias car tech forecast b automotive business like experience personal car driven completely ai tried december san francisco riding joe taylor senior systems engineer mercedes automaker chars,news
image courtesy warner bros already amazing start comes horror films primate fun animals attack movie years later bone temple already set extremely high bar rest years po already amazing start comes horror films primate fun animals attack movie years later bone temple already set extremely high bar chars,news
