clean_text,source
sight unseens official design guide map mexico city plus preview design exhibitions happening art week zonamaco welcome new sight unseen weekly newsletter delivers best design world news trends shopping advice interviews travel recs straight inbox youre chars,news
installed latest update google pixel may facing number critical problems heres everything know issues youve installed january android update experiencing connectivity issues theres lot reddit user explained theyve tried every recovery reset fix chars,news
mgb roadster powered liter honda fc inlinefour modified aem standalone ecu aluminum radiator stiff polyurethane engine mounts paired sixspeed manual transmission finished metallic blue black viny mgb roadster powered liter honda fc inlinefour modified aem standalone ecu aluminum radiator stiff polyurethane engine mounts paired sixspeed chars,news
pope leo doubles vatican rejection coredemptrixat time apostasy impurity confusion faithful need diminished motheron thursday morning pope leo xiv publicly praised vatican document already sparked one skip comments pope leo doubles vatican rejection coredemptrix lifesite news january johnhenry westen posted pm pst ebb tide thursda chars,news
win home greek side paok secured lyon firstplaced finish europa league standings roma without injured evan ferguson scraped eighth place direct passage last draw panathinaikos final win home greek side paok secured lyon firstplaced finish europa league standings roma without injured evan ferguson scraped eighth place direct passag chars,news
editors note casting love la costar marty supreme breakout odessa azion zoe gutierrez adaptation holly brickleys deep cuts triggered backlash online character written jewish woman mexican heritage editors note casting love la costar marty supreme breakout odessa azion zoe gutierrez adaptation holly brickleys deep cutstriggered backlash online character chars,news
gdcs state game industry survey says number jumps nearly half among lgbtq devs situation us right great particularly noncitizens promised crackdown socalled illegal immigrants us president donald trump become violent freeforall chars,news
sydney sweeney opening politics labeled maga barbie social media reported summer sydney registered member republican party florida one year earlier news came american e sydney sweeney opening politics labeled maga barbie social media reported summer sydney registered member republican party flori chars,news
kim kardashian breaks silence royal photogate drama meghan markle prince harry revealing innocent post sparked internet controversy kim kardashian dished crazy drama surrounding familys royal photogate involving meghan markle prince harry duke duchess sussex went noticeably missing kris jenn chars,news
southern california investor secured ninefigure acquisition financing deal acre redevelopment orange county calif hopes lure costco anchor tenant dwight manley real estate developer television producer sports southern california investor secured ninefigure acquisition financing deal acre redevelopment orange county calif hopes lure costco anchor tenant dwight chars,news
san diego fringe awardwinning play takes us behind scenes stressful callback audition sides debuted san diego international fringe festival took audiences stressful world callbacks play also outstanding premiere riot prod chars,news
parent company saks th last call close locations focus luxury retail stores filing bankruptcy month parent company saks th last call close locations focus luxury retail stores filing bankruptcy month saks global announced thursday chars,news
join vance smith english special event discuss new book atlass bones african foundations europe conversation simon gikandi english book published november university chicago press traces diversity nondiscrimination equal opportunity nondiscrimination princeton university princeton university believes commitment equal opportunity favorable fre chars,news
hod maden trs demonstrates worldclass project estimated b npv projected internal rate return irr consensus metals prices significant project derisking efforts completed last months detailed project engineering tabletrtdtdtrtrtdtable hod maden trs key metrics tdtrtrtdoperating metrics tdtdunit tdtdtdtdlife mine tdtrtrtdtotal go chars,news
stranger things sadie sink tina fey adapting broadway play john proctor villain movie director revealed stranger things star sadie sink teaming tina fey movie adaptation john proctor villain major production update revealed sink recently wrapped final chars,news
pentagon quietly released major policy document welcome back foreign policys situation report learned chinese president xi jinping manchester united supporter rishi also fan club isnt sure fe chars,news
jurors moncton double murder trial thursday heard major police investigation series raids carried killings jurors moncton double murder trial thursday heard major police investigation series raids carried killings rcmp cpl stephane sabourin file coor chars,news
years working screen kristen stewart recently tapped newfound sense respect hollywood oscarnominated actress explained shes suddenly treated like im somebody brain since making directorial de years working screen kristen stewart recently tapped newfound sense respect hollywood oscarnominated actress explained shes suddenly treated li chars,news
lightweight extensible tool managing ebook metadata required part site couldnt load may due browser extension network issues browser settings please check connection disable ad blockers try using diffe chars,news
new study reveals men face heart attack risk seven years earlier women starting mids northwestern research highlights need earlier screening men much higher risk heart attacks women earlier life new study reveals researchers northwestern university found men start develop coronary heart disease years ea chars,news
eventdriven architecture library python extends celery event publishingsubscribing patterns required part site couldnt load may due browser extension network issues browser settings please check connection disable ad blockers try using diffe chars,news
bulls kept collapse happening week bitcoin found buying interest mids prices bounced key range breathing room traders watching markets plumbing headline price reports note p say journalists never truly clock christian thats metaphor lifestyle day navigates evershifting tides cryptocurrency market wielding words chars,news
couple thought getting great deal lowcost flight westjet canadian airline however quickly regretted decision womans foot fianc tried squeeze aisle seat vanessa maldonado vanessasmaldonad couple thought getting great deal lowcost flight westjet canadian airline however quickly regretted decision womans foot fianc tried squeeze chars,news
take trip horology history two tomes hardbound watch coffee table book editors note watches around centuries first pocketable timepieces later wristworn mechanical wonders ultimate collector watches compendium rare chars,news
hong kong china jan globe newswire newbridge acquisition limited nasdaq nbrg company announced today priced initial public offering units per unit units expected listed nasda hong kong china jan globe newswire newbridge acquisition limited nasdaq nbrg company announced today priced initial public offering units chars,news
rest wickeds developer recently explained game launched lower early access price according players support game early get something extra return rest wicked early access since april players waiting hear game finally reach full release moon studios shared rele chars,news
financial freedom think coinbase illusion technical blueprint taking bitcoin radar ghosting surveillance state spending wealth without permission think holding bitcoin coinbas financial freedom think coinbase illusion technical blueprint taking bitcoin radar ghosting surveillance state spending wealth chars,news
jess brownell also tells thewrap exploring francesca violets sexualities advancing whistledown story taylor swift cover post bridgerton boss breaks season steamy stairwell scene immensely hurtful part cliff note story contains spoilers bridgerton season part bridgerton season premiere set idyllic cinderella story benedict bridgerton luke thompson new arri chars,news
new york jan globe newswire kirby mcinerney llp reminds investors purchased bellring brands inc bellring company nysebrbr securities contact lauren molinaro kirby mcinerney llp email investigationskmllpcom new york jan globe newswire kirby mcinerney llp reminds investors purchased bellring brands inc bellring company nysebrbr securities contact lauren molinaro ki chars,news
regency era society papers transformed drawing room whispers widely read public news similar bridgertons allknowing lady whistledown dearest gentle reader waited months lady whistledowns latest society papers distributed across ton youre good company true history printed chars,news
wondering watch streaming every week mobilesyrup outlines notable new movies tv shows typically focus new content amazons prime video crave disney netflix services like apple tv paramount wondering watch streaming every week mobilesyrup outlines notable new movies tv shows typically focus new content amazons prime video crave disney chars,news
ever wanted robot personal assistant might luck elon musk gonna start building lot em expense big chunk automotive division ever wanted robot personal assistant might luck elon musk gonna start building lot em expense big chunk automotive division tesla chars,news
earlier version article appeared march year lists sister elizabeth decided observe nospend february nospend month means committing buying essential items daysno discretionar earlier version article appeared march year lists sister elizabeth decided observe nospend february nospend month means committing chars,news
sandisk stock surged reporting blockbuster fiscal secondquarter results adjusted earnings per share soaring yearoveryear billion sales companys strong performance driven increase data cen sandisk stock surged reporting blockbuster fiscal secondquarter results adjusted earnings per share soaring yearoveryear billion sales companys chars,news
state game industry survey report conducted gdc festival gaming revealed number interesting insights current state game development landscape report showed us game industry workers strong state game industry survey report conducted gdc festival gaming revealed number interesting insights current state game development landscape th chars,news
president donald trump held first cabinet meeting focusing economy housing energy health initiatives drug prices painted positive picture administrations accomplishments claims exaggerated trump men president donald trump held first cabinet meeting thursday focusing economy housing energy health initiatives drug prices painted rosy picture adm chars,news
antiice protests saturating americans emotion intense performative increasingly untethered reality news pouring minneapolis last weeks generating strange sense dj vu protests midwestern city saturating americans emotion intense performativ chars,news
take upper west sider k new york post may compensated andor receive affiliate commission click buy links featured pricing subject change may biased moms upper ea chars,news
bridgerton season benedicts love interest sophie baek tragic backstory tied family history shes referred ward really mean bridgerton yerin ha sophie baek episode bridgerton liam danielnetflix warning spoilers ahead bridgerton season episode benedicts season bridgerton made debut chars,news
notebooklm adding video overviews support ability customize infographics android ios apps notebooklm adding video overviews support ability customize infographics android ios apps heading studio tab reveals option generate video overviews right fro chars,news
perth australia jan globe newswire alkane resources limited asx alk tsx alk otcqx alkef alkane executed term sheet comprising conditional placement earnin agreement nagambie resources limited asx nag nagambie perth australia jan globe newswire alkane resources limited asx alk tsx alk otcqx alkef alkane executed term sheet comprising conditional placement earnin agreemen chars,news
thousands scientists already experimenting ai study cancer brain disorders post google deepminds alphago decodes genome million letters time appeared first singularityhub dna stores bodys operating playbook genes encode proteins sections change cells behavior regulating genes turned yet others dark matter geno chars,news
yearold man mexico survived emergency surgery doctors warning dangers popular cocktails post liquid nitrogeninfused cocktail caused mans stomach burst drank appeared first thats int yearold man mexico survived emergency surgery doctors warning dangers popular cocktails jandira sonnendeckunsplashliquid nitrogen safe theat chars,news
sundance festival featured diverse mix womens perspectives filmmaking genre style production spotlighted directors across notable films like witness recants directed prolific dawn porter josephine directed danielle brooks bodhi jordan dell appear go miss walter thompsonhernandez official selection sundance film festival courtesy sundance institute phot chars,news
today apple tv press day apple tv unveiled first look apple original films way warrior kid director post apple original films way warrior kid starring chris pratt linda cardellini jude hill premiere chris pratt jude hill star way warrior kid premiering globally november apple tv today apple tv press day apple tv unveiled first look apple origina chars,news
democrats big plans happens november taken seriously leftist protesters stormed cities church st paul minnesota sunday service jan chanted screamed told frightened children parents chars,news
dear readers oh boy havent written horoscopes several months hit serious wall writers block end post omg stars horoscopes year ahead appeared first omgblog photo krystle merrow dear readers oh boy havent written horoscopes several months hit serious wall writers block end summer coupled inability chars,news
travis kelce breaks chair new clip upcoming new heights episode kansas city chiefs quarterback shown talking brother jason kelce podcast travis suddenly falls backward chair sitting breaks make travis kelce breaks chair new clip upcoming new heights episode kansas city chiefs quarterback shown talking brother jason kelce podcast travis suddenly f chars,news
minnesota timberwolves toronto raptorsdate february th time pm cstlocation scotiabank arenatelevision coverage fanduel sports network northradio coverage wolves app iheart radio wolves fans cant nice things minnesota timberwolves toronto raptorsdate february th time pm cstlocation scotiabank arenatelevision coverage fanduel sports network northradio coverage wolves app iheart radio chars,news
chipotle stock sinks restaurant chain reports falling traffic weak guidancecnbc chipotle stock sinks company reports q samestore sales drop forecasts sales growth yahoo finance chipotles outlook falls short estimates shares de fine print following comments owned whoever posted responsible way,news
morgan stanley bullish chinas humanoid robot market forecasting sales surge yearoveryear units supplychain costs decline mass production accelerates humanoid robots expected gain initial traction industr save user id password subscribers prefer save login information enter user id password time visit site activate function chars,news
jake gyllenhaal heading netflix new action thriller tuesday february announced yearold oscarnominated actor starring new movie kill switch written harrison query keep reading find moreas r jake gyllenhaal heading netflix new action thriller tuesday february announced yearold oscarnominated actor starring new movie kill switch wri chars,news
dr peter attia celebrity doctor helped popularize longevity craze apologized following release emails exchanged jeffrey epstein dr peter attia celebrity doctor helped popularize longevity craze publicly apologized faces growing backlash following release email exchanges late chars,news
today apple tv press day stars margos got money troubles alongside prolific storyteller david e kelley took post apple tv reveals teaser margos got money troubles starring elle fanning michelle pfeiffer nicole kid elle fanning margos got money troubles premiering april apple tv today apple tv press day stars margos got money troubles alongside prolific storyteller david chars,news
wall street seeing investors turn away ai darlings toward safer investments rout sector led losses across major gauges us stock futures wavered wednesday though wall street found calm techled slide amid fresh wave earnings wall street waited alphabet goog googl results reveal chars,news
audio beat detection segmentation remixing library using librosa repository contains rosabeats python library allows audio beat detection segmentation remixing leverages power librosa audio processing libraries enabl chars,news
president donald trumps opinion colombias leader swung sick terrific facetoface white house meeting eased tensions ideological foes bloomberg president donald trumps opinion colombias leader swung sick terrific facetoface white house meeting eased tensions ideological foes content reserv chars,news
article republished conversation creative commons license read original article operations immigration customs enforcement intensified past year politicians journalists alike begun referring seemsbad dept article republished conversation creative commons license read original article operations immigration customs enforcement chars,news
flowers makes sameday delivery affordable especially valentines day deals coupon codes love flowers sale flowers helps send fresh floral arrangements plants gift baskets almost occasion birthdays anniversaries sympathy h chars,news
honda tl acquired seller reportedly neighbor original owner subsequent work included replacing tires drive chain ignition points spark plug along adjusting valves changing fork honda tl acquired seller reportedly neighbor original owner subsequent work included replacing tires drive chain ignition points spark plu chars,news
maisie peters speaking response haters dont like voice doesnt care hot boyfriend likes yearold english singersongwriter posted mystery guy new tiktok video promoting maisie peters speaking response haters dont like voice doesnt care hot boyfriend likes yearold english singersongwriter posted chars,news
interview marks llamas first sitdown interview trump since became nbc nightly news anchor june post trump locks nbc news interview tom llamas years sleaze dig appeared first thewrap nbc nightly news anchor tom llamas set sit donald trump wideranging interview white house nearly years president blasted sleaze llamas confi chars,news
one persistent myths western political thought idea united states european allies principled opponents fascism totalitarianism doctrine many washington elites believe almost religious level one persistent myths western political thought idea united states european allies principled opponents fascism totalitarianism doctrine chars,news
tvns spring fever enas honour soared new heights last night february spring fever achieved highest viewership ratings date ahead final week run according nielsen korea romantic comedy rose average tvns spring fever enas honour soared new heights last night february spring fever achieved highest viewership ratings date ahead final week run according chars,news
korean business research institute revealed months brand reputation rankings rookie idol groups rankings determined analysis consumer participation media coverage interaction community awareness indexes korean business research institute revealed months brand reputation rankings rookie idol groups rankings determined analysis consumer participation medi chars,news
ea reported earned net income million revenues billion quarter ending december post battlefield propels ea billion revenues appeared first thurrottcom ea reported earned net income million revenues billion quarter ending december figures represent decline percent gain percent chars,news
edmonton alberta feb globe newswire youve told doctor healthcare professional youre risk developing type diabetes could probably use nonjudgmental support prevent disease stay healthy small edmonton alberta feb globe newswire youve told doctor healthcare professional youre risk developing type diabetes could probably use nonjudgmental chars,news
kelly clarkson announces kelly clarkson show end seven seasons prioritize kids singer promises fans isnt goodbye kelly clarkson announced end daytime talk show seven seasons instagram post shared monday feb yearold singer announced popular talk show kelly clark chars,news
nigerias national assembly denies deliberately stalling electoral act amendment repeated delays raise concerns reforms election read house representatives dismissed allegations national assembly deliberately stalling consideration passage electoral act amendment bill saying proposed legis chars,news
chipotles stock dropped significantly company projected sales growth cautious outlook overshadowed betterthanexpected earnings revenue last quarter decline customer traffic ongoing economic pressures con chipotles latest earnings update gave investors little comfort year ahead company narrowly beat wall streets profit revenue estimates sales trends told tougher story sa chars,news
manager trains people stop caring shouldnt shocked register shows pexelsreddit customer service phrase customer always right often leads nothing trouble feardriven food service job writeups handed literally everyt chars,news
advanced micro devices inc easily beat wall streets expectations latest financial results although offered bullish forecast current quarter still disappointed analysts expecting chipmaker show even stronger advanced micro devices inc easily beat wall streets expectations latest financial results although offered bullish forecast current quarter still disappointed analy chars,news
toronto feb globe newswire purpose investments inc purpose today announced news releases november september proceeding merger purpose ether staking corp etf cboe canad toronto feb globe newswire purpose investments inc purpose today announced news releases november september proceeding chars,news
new york feb globe newswire rosen law firm global investor rights law firm reminds purchasers securities bath body works inc nyse bbwi june november dates inclusive class period new york feb globe newswire rosen law firm global investor rights law firm reminds purchasers securities bath amp body works inc nyse bbwi june chars,news
videoany liberals discount charge minnesota elected officials especially lt governor peggy flanagan aka flan southside administrators signal chat group another conspiracy theory ridiculous dismissal blown skip comments video minneapolis teachers union president spills beans signal chat administratorsrumble february dummie funnies posted pm pst chars,news
bronwyn newport new man life monday night february yearold real housewives salt lake city star went public new boyfriend model brandon good stepped broadway date bronwyn brandon attended bronwyn newport new man life monday night february yearold real housewives salt lake city star went public new boyfriend model brandon good stepped ou chars,news
floyd mayweather says made billion bucks earnings legendary career fighter claims money didnt make bank account hes suing showtime claiming played big role permalink floyd mayweather says made billion bucks earnings legendary career fighter claims money didnt make bank account hes suing showtime chars,news
game thrones loves play specific character archetype knight seven kingdoms doesnt disappoint unhinged monster every series game thrones franchise needs joffrey baratheon knight seven kingdoms revealed character fills mold back hbos hit fantasy series began au chars,news
west coast shaking recent weeks witnessed much seismic activity along portion pacific ring fire sits directly along california coastline hope shaking would settle instead article originally published michael snyder economic collapse blog title earthquakes hit san francisco area week san andreas fault entering da chars,news
envy economy anime portrays textures dynamic relationship glean years psychological causeandeffect short montages sparse narration premieres nonlinear timeline made obvious journal witch believe past present discrete week anime flips back forth decades without chars,news
wanted put black british comedy map baftawinning tv presenter mo gilligan returns netflix third standup special global streaming giant whats different time around gilligan long story share th chars,news
learn looking archaeopteryxs fossilized mouth uncovered weird features unique birds supporting ability fly birds didnt invent flight theyre pretty good good fact evolution birds dinosaurs makes oldest group flying vertebrates still existence today pinpoi chars,news
turns looking grandparents tips survive festival season one guy climbed sound pole doubt order rack social media cred quickly escorted security ageold argument person refused stop filming chars,news
image courtesy netflix exciting start first month year introduces fans greatest anime ever seasons biggest series winter lineup include sequel seasons jujutsu kaisen frieren exciting start first month year introduces fans greatest anime ever seasons biggest series winter lineup include sequel se chars,news
top news tenet healthcare regains full ownership subsidiary conifer top news tenet healthcare regains full ownership subsidiary conifer health solutions unwinding joint venture commonspirit health conifer pay million redeem commonspirit chars,news
