clean_text,source
hello dear students mai ne film review bhi upload kiya hai bahoot hi easy language jaldi se us ko check kar lo,youtube
thank,youtube
mam aap padhati baghun acchi ho likin sambhaji nahi chatrapati sambhaji maharaj boliye please,youtube
writing skills batyo mam,youtube
nhi hai,youtube
mark milege itne likha please fast reply,youtube
myam aagr yehi likha kuch nhi hoga na,youtube
magzine review,youtube
mam review beautiful chhatrapati sambhaji maharaja write sambhaji maharaja,youtube
best,youtube
par year hai maan naki,youtube
mam aapne jo point likha hai vahi likhana hai kya,youtube
thank much maam,youtube
aur madem ye jyada short nahi full marks milenge naa,youtube
madem front page back page puchte hai kya likhna hai fir,youtube
thank much mam khup chan,youtube
mam mein se milenge agar aisa likha toh bcoz itna chota hain marks milenge lagta hain,youtube
review hame paragraph likhna hai ya points,youtube
mam chava spelling aapne likha hai vaise hi sahi hai kya,youtube
mam chava ki spelling konsi likhe,youtube
thank maam,youtube
expansion idea,youtube
mam bus mera last question hai review ko paragraph form mai likhe ya jesa appne likha hai khula khula line chor kr wesa,youtube
mam table format main bhi interview atta hai main aya tha,youtube
novel,youtube
thank much maam app ka video dekh kar mera board ka exam ka dar nahi lagraha thanks,youtube
thanks maine ye film review likha tha full marks aagye aapka n tha thora tora tha keep thank uyy,youtube
speech writing,youtube
novels personal response plss plss,youtube
mam paragraph nahi likha marks nahi katenge,youtube
pura yesahi likha marks milenge na mam,youtube
thank mam,youtube
konsibi movi ya kosa bhi book chalta,youtube
mam chava special mistake right chhava haii,youtube
thank much mam youre great mam,youtube
maam kya aap appreciation ka bhi easy learning wala vedio dal skate ho kya please dal,youtube
thank maam apne hamara tension kam kar diyathanks lot maam,youtube
mam plz urdu ke liye bhi,youtube
qc woh batao,youtube
great picks,youtube
buy,youtube
yes,youtube
indian rainbow great read madam,youtube
bro first ever book got time reading october junction divya prakash dube bro nice book anyone knows,youtube
books four aggreement comfort book atomic habits ramayan mahabharat mahagatha rekta books poetry women love much artist way,youtube
recommendation teen atomic habits ikegai anne green gabbles strength scares little prince greenglass house mansfeild,youtube
wanna start reading go psychological thrillers like never lie frieda mcfadden rather self help books,youtube
wtf list,youtube
want suggest read quran damn sure youll gonna love reading guides every single step life famous book ever know,youtube
read good girls guide murder say goodbye,youtube
u wanna really get readingread literally book holly jacksonmy pick would agggtm u like dystopiantry shatter book lynn painter also amazing,youtube
poor recommendationplease upgrade recommendation game,youtube
bro l read vegetarian super creepy many questionable things l absolutely loved reading good keeps u hooked,youtube
really bad recommendation someone wants start readingand plz dont call mahabharat history diff history mythology,youtube
would recommend good feel bad good vibes good lifeand wardd,youtube
dear maam im currently writing book around complete planned release amazon within next months im reaching early request support goes live even short review mention would greatly help thank much time encouragement,youtube
ikigai better self help books youve mentioned,youtube
bhagwad geeta team,youtube
people like reading classicsthen go animal farm short good book,youtube
sry say totally boring recommendation books,youtube
want cutefeel good bookyou go days morisaki bookshop,youtube
surely read books recommend recently read novel allah miyan ka karkhana mohsin khan latest sensation literary scenario sincerely request review novel available hindi read come soon languages including one english harper collins english im interested reading english review better know novel recently honored bank baroda rashtrabhasha samman published rekhta critics described mirror reflects societys harsh truths poignantly portrays innocence especially children punished injustice defenseless continues thrive work raises profound moral social questions resonate deeply times review novel would invaluable literature lovers offer viewers fresh perspective,youtube
book kaha se milegi ye bhi bata,youtube
mountain genuinely love book helps transforming self sabotage self mastery,youtube
must read uninstall future ai diljot kaur available amazon paperback ebook dont forget put ur reviews science fiction recommendation read till end indian author,youtube
recs someone wants get reading loves cdramas read ann liangs books youll fall love want read mythology fiction hidden hindu trilogy akshat gupta perfect want read suspense read silent patient plot crazy want read something related self harm rape read way used shows raped someone close getting correct environment discuss loved ones change also read girl pieces,youtube
itni sari books lene ke bad kah rahi hai like cannot find choice books,youtube
atomic habit really goodalso try ikigai youre beginner,youtube
atomic habits like bhagwat geeta,youtube
much thankful wondering life hell book recommends women love muchthey showed path started reading still yet complete book exactly need foru dont know much book helping come boundary built understood childhood trauma reason living lifei hoping completing book changed person grt life aheadlots love,youtube
pls read selecting books beginner scratch want get reading try small adventure books good storyline dont get bored stop reading start feeling miserable later slowly explore different genres authorsi would never recommend straight away start nonfiction find preferred genre books truly enjoy trust started reading journey books simple thea stilton series enid blyton nancy drew transformed voracious reader books like thousand splendid suns girl knew much litte lifekite runner girl pieces tuesdays morrie colour water james mcbride equally different engaging stories thanks reading hope find good books read,youtube
app use edit videos,youtube
strangers,youtube
plz give small summary help us choose best one,youtube
comment section empty really enjoyed watchingmore listening,youtube
monkey paw also good something horror interesting read first thank later,youtube
found atomic habits boaring,youtube
bata aaisa rahi hai jaise puri book padh li ho,youtube
reading subtle art giving fuck next ill read atomic habits,youtube
like looks good books,youtube
recommendation beginner chose read sudha murtys books like good range age groups eventually keep upgrading read book called astitva translated marathi liked much small book recommend,youtube
self help book power subconscious mind love one badly,youtube
loved recommendations,youtube
part please beg,youtube
forest enchantments,youtube
read diary young girl anne frank first book niceee heart warming book,youtube
suggest philosophy books small books finish fast,youtube
diu read angels morgan hills shall tell president damn amazing,youtube
wisebits stories like blinkist novels helping tackle reading goals without stress,youtube
never knew wanted till,youtube
love book suggestion vids always find gems,youtube
looking new reads perfect timing,youtube
u must read truth without apology acharya prashant,youtube
idea start love,youtube
wow needed fresh book ideas thanks,youtube
cant wait check,youtube
finally found next read,youtube
di im years old read books really interesting means im asking pls tell,youtube
part,youtube
read ikigai love helps us realize stay young heart give importantance every moment life,youtube
kya ramayan aur mahabharat bta k chle gye yr inko kya padhna jitna janna zaruri h utna tv dekh liya sabne,youtube
hey dear book mahabharat unravelled good book reading book dont know felt like writer intentionally wanted portray character karana bad light know karanas character already controversial book kept feeling writer personal grudge,youtube
fiction pleaseeeeee,youtube
reader approve recommendations good taste fs,youtube
dhanyabad mataji,youtube
try goodbi love shubham garg might,youtube
im new booktuber,youtube
start reading hactic day,youtube
ramayana forest enchantments chitra banerjee devakaruni must read freaking good,youtube
mahagatha loved,youtube
experience want get reading diaryof young girl mountain echoed romance norwegian wood suspense silent patient good girl guide murder sherlock holmes indian authors palace illusion chitra banerjee curse letting go dark romance haunting adeline hunting adeline romcom funny story emily,youtube
recommendations verity silent patientfav housemaid series self help cry die secret,youtube
use read book neet prep,youtube
taste reading,youtube
part plzzz,youtube
like reading short ones cappuccino code novel really enjoyed,youtube
mother maxim gorki trial metamorphosis franz kafka interpreting dreams segmend frued read books lenin marks josef,youtube
edit reels like,youtube
hinglish romantic book plz suggest,youtube
ramayana mahabharata nonfiction,youtube
read atomic habits di pls btiye neet aspirant read atomic habits pls pls btiye,youtube
boring recommendations someone wants get reading,youtube
p please,youtube
part waiting,youtube
favoutie room roof perfect one,youtube
currently reading silent patientjust started,youtube
hi promote books want promote book please reply thanks,youtube
atomic habits one favourite books,youtube
love recommendations,youtube
try mother never knew sudha murthyall books sudha murthy nice,youtube
yes di recommendation got vegetarian atomic habits book really amazing even recommendation please go ikigai psychology money,youtube
reading books years finding inspiration must read wings fire book sufficient change life,youtube
please read shadows thought nice poems,youtube
omg im huge fan mahagatha extremely engaging book,youtube
get time read books,youtube
mam hindi translation konsi book sabse bdiya h,youtube
woww finding good books reat,youtube
reader like read historyi currently started reading mahagatha really good book,youtube
thank much,youtube
good book review,youtube
real boss,youtube
thank gor information good job,youtube
proud,youtube
excellent,youtube
thank information great job,youtube
nice,youtube
omgggggggg nice,youtube
wow nice,youtube
thank summary holiday home work,youtube
thank helping project,youtube
handwriting bad bad handwriting play dont say police officer,youtube
mantra today dukaan kitna,youtube
chhava,youtube
super,youtube
superb quality,youtube
chava chhava,youtube
proud people write another review write chhava,youtube
really much good excellent,youtube
dirty,youtube
proud people write another review write chhaava,youtube
nice continue,youtube
bought alchemy secrets yesterday,youtube
read mr turuptthe books long chapters believe chapter mini chapters inside big chapters mini chapter different persons perspective,youtube
thats first time ive seen someone rate fearful five stars,youtube
ryan,youtube
might adult love books especially fantasy ones ive longing really interesting one thank might read knows definitely help find right book,youtube
day asking friends,youtube
read fake skating lynn painter good,youtube
read review medoran chronicles lynette noni love want see people think,youtube
day asking read operation frog effect,youtube
heard enemies lovers eyes lit,youtube
forth wing iron flame onyx storm,youtube
yesss broken country book bought havent read yet makes happy see everyone liking,youtube
haylee pregnant close angles optical illusion clothing lmao cringe announcement videos definitely cant wait,youtube
reading books month insane usually takes month read one unless im already hyperfixated pick book like got hyperfixated long walk stephen king read entire thing today,youtube
ive read like books,youtube
books one month insane reading pace,youtube
read lotm,youtube
woah didnt know fearful released hooked fearless reading,youtube
wanna read prison healer lynette noni makes amazing books,youtube
hi,youtube
great reviews characters must head characters stay must well written thank,youtube
love,youtube
oh thought u meant wrote books september screamed,youtube
nonfiction books read fiction noy reading nonfiction missing whole sections history make game thrones look absolutely tame,youtube
elin hilderbrand daughter alchemy secrets want read thanks sharing youve read read lot one month quite impressive also wanna read new book released called one way another based stranger things stories,youtube
watermark top book corner,youtube
oh gosh love fantasy thank showing way,youtube
good titles,youtube
yall read percy jackson promise u might seem like childrens book childish legit made adults younger,youtube
read amulet book chapters soo good swear best time new york book,youtube
one read hard fake piper lawson,youtube
wait theese sound good,youtube
updated tour home library got lot books,youtube
im gonna made fun school doesnt help im guy,youtube
okay two book series definitely read naturals jennifer lynn barnes powerless lauren roberts,youtube
read beginning everything,youtube
used read much th grade fell th im senior btw books counting arent actual books ive read like im currently reading animal farm george orwell im trying finish actually short book hard time actually sit read reason im book yk,youtube
tried academy review literally threw away way raunchy familys taste,youtube
read many books tried able read pages self help fiction,youtube
need read witcher hunger games,youtube
question know young adult christian books parents strict read,youtube
really like read books encourage read,youtube
read left behind series tim lahaye jerry b jenkins really good,youtube
god bless,youtube
dont really know reading taste please read medoran chronicles lynette noni,youtube
read good girls guide murder series holly jackson,youtube
read life walter boys ali novak finished loved,youtube
ever read series mind heart dreams,youtube
read manga,youtube
please read legend series marie lu favorite book series would love see read books series btw legend prodigy champion rebel,youtube
start reading books never finish,youtube
prison healer series amazing first book definitely slow plot quickly picks nd rd books,youtube
u please read ann liangs books,youtube
read walked sky awesome loved ever second,youtube
review holly jacksons book series good girls guide murder make ryan read,youtube
begining fearful ending bad,youtube
definitely read eyes ella justice great author came leafs romantic young audience base romantic fantasies really good hockey really good youre eyes summer leafs falls also fall fall winter summer spring seasons,youtube
idk like murder books kinda kids book around pages called blood water,youtube
seehow mindful kind rating book,youtube
u librarian,youtube
post plz im dying,youtube
ive got book suggestion really fantasy called land neverendings,youtube
hey read books text btw read many comic books possible days manga super hero stuff comics video day,youtube
love reading books,youtube
hey read books text btw read many comic books possible days manga super hero stuff comics video day two,youtube
dont know anyone time read books month,youtube
hey read books text btw read many comic books possible days manga super hero stuff comics video day one,youtube
september reads well read heroes olympus lost hero would give stars start book pretty boring towards end gets better end sentence book wasnt clear made want go second book faster,youtube
sorry im new channel ryan still together,youtube
read selection,youtube
wait read read always isnt forever romance book,youtube
could please book recommendations,youtube
girlie series love called lunar chronicles awsome far future dystopian series iconic charecters like cinderrela snow white stuff exisct similar auhtors name marrisa meyer underrated af also book series like romance fantasy ish technology stuff combined elegant addicting way want read first book called cinder,youtube
yessssssssss finally started prisoner healer seriessss good im sooo excited,youtube
think im emotionally wrecked im years old mom found read write fanfictions,youtube
gen z old gen z read manga,youtube
read harry potter philosophers stone im reading im trying whole series,youtube
dagger flame catherine doyle stars fearful lauren roberts stars prison healer lynette noni stars alchemy secrets stephanie garber stars academy erin hilderbrand stars heartbreak hotel ellen oclover stars broken country clare leslie hall stars,youtube
hey vid idea basically read child books recommend also rate keeper octopus idk billy gaunt adventure series promises lies land stories series grandest book world get likes also love channel,youtube
try mind two books,youtube
girl wish could read like read one book september,youtube
know book good wish wrote,youtube
kool stuff,youtube
prison healer series gets better agree first book slow start wow gets awesome,youtube
hello ryans wife,youtube
love types videos please short sweet point,youtube
please keep need mostly clean good book recommendations,youtube
going start reading books,youtube
months ago binged like videos love way explain books literally convinced read books loved thank much im looking forward reading book next,youtube
come back fable miss,youtube
u recommend books yrs old would love get recommendations,youtube
rs amazon rs amazon rs flipkart,youtube
books real value doesnt determine price content core important,youtube
better read instead showing,youtube
bhaibooks ka matalab yeh nahi hota amount dekha cover judge kiya aur nikal liya books ka matlab hai auska andhar ka gyaan ko samjhna chahiye wahi sa insaan ki knowledge badta hai aur wo wale book yehi book tumhe bheed mai sa nikal kar alag banayegi,youtube
power book,youtube
book prince,youtube
dont judge book cover,youtube
bro wtf,youtube
bro flexing money,youtube
bro think,youtube
woh book ko padhna hota hai,youtube
bought,youtube
bro whose seeing machiavelli pages,youtube
bro dont judge books value quality please read book find knowledge book eith,youtube
bahi ke cherhe ka expression tho dheko,youtube
definitely say u doesnt read book,youtube
mean rs book book respected respect dont give review stupid recommendation ever,youtube
knowledge expensive book,youtube
bro gives content topics lawsthe quality doesnt matter take u like,youtube
idiot judging book appearance instead knowledge providing,youtube
maybe saw niccolo machiavelli,youtube
agrej ki awaload,youtube
machiavellis face book,youtube
fun fact contain lesson,youtube
usko padke dekhle,youtube
content important looks dont matter,youtube
bhai hi hai siraf cover hi change hai dont wast money cover different hi robert green ne likhi hi,youtube
bro book literally best book find bro book knowledge bloodline iq together,youtube
machiaveli got,youtube
books content books made read flex brother,youtube
book studying bro smelling,youtube
quality doesnt matter content,youtube
fact books provide knowledge,youtube
brother knowledge expencive book,youtube
smell like paper bruh,youtube
pdhna h ya book ka feel dekhega,youtube
bros bookasm,youtube
bro pls read shit,youtube
zesty ahh review,youtube
wowthe side shows machiavelli one side robert greene side,youtube
read lot learnt nothing,youtube
yaar pdf download kar k padi thi,youtube
thankyou making amazingggggggggggggggggggggggggggggggggggggggggggggggggggggg,youtube
ill rather buy wali acchi quality value money,youtube
smell test,youtube
tera baap deta hai ye,youtube
kya yaar bina sar pair ki baten karte ho book banaya gaya hai padhne ke liye,youtube
paisa barbaad k ke kitne sare books aa jate,youtube
power book valuable rs,youtube
lwde,youtube
need book decor knowledge,youtube
get link book,youtube
tf folds paper even cheap supposed use book mark,youtube
hi im fan street side book vendors share several purchases years sometimes dont find want im like fine ill random example several years back probably decade sucked world metro dmitry glukhovsky playing pc game wanting read english version couldnt find put hat searched seven seas epub took straight photocopy shop paid like dunno ppage got discount high page count needed told guy make proper booklike version spiral binding sided brochure printing standard book size covertitle page etc end nice copy book argh im rambling anyway much much later found expensive limited edition holding felt moment aura mana power solid feels whatever one may call golden edge print heavy embossing front back thicccc gsm etc etc yea specialty binded books may reality binding us spells blame look beautiful huh coming back clip dualimage edge print two finest minds times brilliant never seen anything like textured finishes nice touches congrats purchase keep safe away relatives friends wishing borrow lol,youtube
sala abhi jake exchange karega,youtube
bro u know u ignored powerfull book laws power book knowledge normal,youtube
aurthor differ book,youtube
bro dont need quilty need knowladge,youtube
never judge first read say,youtube
texture colour smell feel ye sab ka kya tel dalna hai,youtube
molasting book,youtube
rich kido,youtube
materialistic ho raha hai tu,youtube
wtf want book look good want book simply get something valuable stupid,youtube
fact got book concise part treat like idol try respect much first book got saving monney bit bit also got second hand book store since dont much book store live ask parents buy online scold saying dont need things need focus schl textbooks,youtube
way books first chapter says never outsine masterbut judge book coververy funny,youtube
reader totally disagree bending pages turning like even rupees book,youtube
hell laws power rupees,youtube
bro second book name,youtube
dont insult laws power,youtube
get big book rupees,youtube
ill give rupees give book,youtube
seeing machiavelli,youtube
bro chair use,youtube
vote rs book,youtube
subscribehr study,youtube
strong resemblance demis hassabis,youtube
baa guddha balsindhi ra neeku,youtube
bro book reading get lessons smell texture like stupid things,youtube
idiot didnt show text print quality got excited fore edge,youtube
dont judge books knowledge quality tell knowledge smell taste paper way treating books literally right,youtube
like day study,youtube
bhai hell wrong reviewing books burhh idk youtube reccomended rs book far superior gold shit worth k,youtube
costs one u mentioned cheap,youtube
like min study joking guys,youtube
care knowledge,youtube
bhai mere liye bhi ek laade,youtube
books wtf wrong read words understand ideas expensive books teach automatically,youtube
mannnn youre buying books think read one read one wouldnt uploaded video,youtube
like hr study,youtube
many people doesnt even get knowledge getting getting precious life lesson btw cheap pirated actual price also good paper quality,youtube
rs book,youtube
never judge aa bookk without cover,youtube
judging book way treating like shit need grow buddy read learn think behaving like shit,youtube
like km running,youtube
dont hurt book,youtube
kahan se mila bhai appko,youtube
unknown book sacrament clive barker absolutely hated really hard follow along,youtube
personally loved thats opinion,youtube
hate belly much,youtube
help please,youtube
wearing tiara scl american main character thing,youtube
without merit wanted sleep uncle,youtube
uhhh read ends useven tho ppl warned soooo yeah,youtube
whole pjo series purpose rereading,youtube
polish book kiedy ci odnajd like wtf,youtube
powerless boring,youtube
assistant villian,youtube
literally every colleen hoover book,youtube
summer turned pretty like summer put makeup ruined whole family,youtube
book ive read school go back read enjoy,youtube
ok love,youtube
im reading rn wearing tirara school lowkey scared though joke first choice yk,youtube
acotar tamlin yes acotar,youtube
shades grey also sad,youtube
read thousand boy kisses wish could unread sad like crying eyeballs poppy diedand played cello last timethat sobbing middle ela class still amazing book though lovehate relationship book,youtube
friend read first book loved much since wearing tiara school weirdly pulls really well like subtle nod character,youtube
um help im reading,youtube
silent patient bad,youtube
good girls guide murder read first time,youtube
loved made cry soooo hard summer turned pretty made fuckin angry hyped,youtube
love dog bad,youtube
literally stopped reading wore tiara schooli like thank,youtube
unpopular opinion maths textbook,youtube
unpopular opinion powerless series,youtube
summer turned pretty fact name belly cringe enough,youtube
red queen read,youtube
secretly much spice,youtube
go set watchman makes kill mockingbird completely meaningless,youtube
every book ive read read,youtube
powerless cuase ruined made fall love,youtube
booktok coming youtube,youtube
cant get literally naming favorive books,youtube
bro im sorry thing destroy book fandoms,youtube
twilight,youtube
theres girl school started wearing tiaras week ago looked happy wearing like know heart got happy seeing something like told like favorite books relate autumn sooo much,youtube
turner diaries nazist,youtube
wish could unread books even theyre good tell others get unless like sorta thing,youtube
loved wirh loved tiaras honestly wasnt like every single main character girl yk,youtube
gooddd tiaras symbol quirky style well independence finished thought really well written tbh,youtube
