clean_text,source
might late anyone reply anyone else think alchemist series michael scott underrated like ones heard everyone recommend ends loving,youtube
tatbilb good tho,youtube
say boys loved befire overhyped could put book two days straight laughed cried screamed,youtube
thanks sharing always love good book recommendations,youtube
way mouth dropped saw boys ive loved hyped pile like thats favorite book ive red,youtube
tree grows brooklyn slept pretty popular book actually many best sellers,youtube
thank fine choices also novel assunta writer named greco modernday variant epic th century poem divine comedy three books oneinferno purgatorio paradiso forceful love story trip hell heavy depravity slaughtermy cup tea dystopianhorrorsci fi die,youtube
yesss,youtube
hi everyone im absolutely passionate reading getting lost storiesbooks unfortunately buying new books isnt always feasible books gathering dust shelves youd willing share id incredibly grateful donations would mean world fuel love reading whether novels nonfiction anything id love give new home thanks much advance considering,youtube
heres book isnt talked enough ophis gambit really good,youtube
boys loved felt derserved right amount praise,youtube
piece worki would like share maybe helpful one way another based music spirituality,youtube
tree grows brooklyn mention favorite book little kid bought new copy adulthood reread couple years ago still really enjoyed,youtube
ones overhyped opinion opinion better designed probably better marketing well look cover attractive would pick least read says back ones probably wouldnt yes shouldnt judge book cover still,youtube
lala,youtube
hurt said boys ive loved overhyped buts opinion,youtube
loved midnight library overhyped husbands evelyn hugo,youtube
parable sower great,youtube
couldnt get love hypothesis,youtube
put boys loved diabolical know opinion,youtube
boys ive loved iconic,youtube
good,youtube
adding read list,youtube
covers look boring guys wings shadow powers arrogant personality burn solar system keep warm,youtube
yes agree,youtube
agree feel like everyone hyped earth briefly gorgeous dont think underrated,youtube
loved every overhyped book u mentioned,youtube
big swiss,youtube
sword forge michael bell,youtube
normal people,youtube
edge extinction demon road r hyped,youtube
good read may suggest googling reviews black bottle man,youtube
american marriage incredible,youtube
hunger games underrated,youtube
girlllwhyyy midnight library changed whole lifeeee literally,youtube
thanks book recs comfort zone im fantasy reader want get genres,youtube
loved collection,youtube
soooo pretending like tree grows brooklyn considered extremely onfluential book thats part schools curriculums,youtube
literally finished tree grows brooklyn today hyped see video nobody ever talks hands one best novels ive ever read,youtube
check leonas blues new upcoming author katina roebuck came yesterday available everywhere books sold disappoint,youtube
heres another underhyped book one pale summer debra phillips,youtube
boys loved iss ssoo good talking,youtube
earth briefly gorgeous definitely talked enough,youtube
love parable sower im looking forward reading american marriage book,youtube
khalilahd hello review novel thank consideration,youtube
never heard overhyped books,youtube
normal people waste time sally rooney good writer use quotation marks sis,youtube
sorry calling octavia butler slept earth briefly gorgeous fucking tree grows brooklyn american classic novel tree grows brooklyn sleeping room us,youtube
honestly feel like heartless hunter really underrated loved iit still cant get good,youtube
anyones wandering book court wings ruins acowar,youtube
tree grows brooklyn mentioneddd,youtube
yk book completely hyped donna hosie one best books ive ever read dont see anywhere,youtube
love hypothesis actually fav read read deep end think one alis best,youtube
warhammer book heresy spot red rising,youtube
think gosling sleepy weird face making want read phm,youtube
reminder,youtube
hot take red rising mid,youtube
dark matter,youtube
whoooaaaa watch boy brandon sanderson,youtube
dungeon crawler carl audible fantastic,youtube
ummmwhats book bro isnt black library warhammer k novelseries entire horus heresy catalog required reading book bro needs corrected asap dude,youtube
project hail mary good,youtube
never read,youtube
started reading months ago yes one must stop first book red rising idd project hail mary joy read still need read many dungeon crawler carl im addicted piranesi got hopes way much expecting something different bad book didnt click,youtube
oh wow ok gotta get book broness going thank god,youtube
hail mary awful,youtube
ngl thought first book slapped loved medieval setting simple task futuristic world,youtube
books listed lockexcept piranesi,youtube
read tales gotrek felix unbeatable fantasy imo theyre part warhammer universe,youtube
bro outsiders requirement,youtube
love enthusiasm keep posting,youtube
death dervish mesa selimovic,youtube
great commentary lol,youtube
dont skip reading dungeon crawler carl audiobook good read listen audiobook treat done one series,youtube
insulted validated,youtube
bible number one,youtube
starts ya hunger games knockoffsyikes,youtube
best served cold,youtube
hot take thought red rising kinda mid,youtube
hey im currently reading real impact daily inspiration truly youre looking true stories inspiring poems motivational quotes one book collected wrote book let know want copy,youtube
got light bringer fr means says full ssries,youtube
red rising day still best series ive read im waiting something top stopped rd book th book goes multiple viewpoints wasnt vibing darrow eff lol,youtube
book kind meh need get second book advice would take move book dont time patience pages world building,youtube
please dont eat dog mandy tsoi hallam extremely eye opening life changing experience must read,youtube
qualify read,youtube
zero conspiracy books even book bro,youtube
like harry potter dune,youtube
never understand person read books rate red rising everybodys lists absolutely hated never bored book rare books punches wouldnt land red rising empty,youtube
read five agree completely deep one really read need another red rising many,youtube
lol books,youtube
ok call crazy golden son awesome actualllllyyyy liked red rising,youtube
finished peranesi dont know gets much praise would really like someone respond settings cool theres goal first book decision made end makes sense character also really mystery second everythings said know everyone except reveal twords end context predict,youtube
true funny lol,youtube
brent weeks like way shadows,youtube
bookbroness ten times size watching clip adding books tbr list,youtube
today discovered book bro im woman,youtube
nextread longer human gf would love hear talk,youtube
best book recommendations ill never read listened whole life,youtube
finished project hail mary started dungeon crawler carli calledand red rising shelf read next,youtube
first red rising favorite tho,youtube
book masterpieceabsolutely loved,youtube
recs good unironically enjoy marvels quippy dialogue,youtube
bro youre reading books teenagers,youtube
fact book tok bro,youtube
im reading war peace shogun brothers karamazov count,youtube
thought mistborn book bro bible,youtube
book taste frighteningly similar mine,youtube
think rage dragons list lol great list except piranesi,youtube
im confused actually good books read bad book bro book bro,youtube
red rising boring,youtube
hilariously catchy reasons read books worthy,youtube
enough read first two red rising books tbr stack,youtube
read books please dont call book vrp,youtube
replace many beware chicken casualfarmer,youtube
guess book brow,youtube
ive read none piranesi probably one likely read science fiction main genre red rising project hail mary havent really jumped secured spot among sf plan read tendency toward slightly older stuff,youtube
dare disrespect brandon sanderson,youtube
part corner psyop people bros,youtube
tolkien dostoyevsky dickens etc,youtube
started last night stayed late frolicking good time clay,youtube
love graybeard gen z identifies bad guys red risingespecially speech like full metal jacket realizing gunny animal mother heroes back day,youtube
yes except red rising,youtube
im book girl finished project hail mary goshhhh rocky adorable great book,youtube
feel personally attacked well except red rising,youtube
brandon sanderson shade lmaoo,youtube
guess im book bro read totally agree,youtube
red rising dope dont wait till second book,youtube
red rising comment serious didnt like red rising much im willing give nd shot actually vouching,youtube
soooooo im trying convince k loving fiance read ones recommend huh lol,youtube
red rising overrated imo,youtube
feel attacked,youtube
damn read except piranesi tbr guess im book bro without knowing,youtube
robinson crusoe,youtube
list need,youtube
way kings,youtube
bro read red rising piranesi year project hail mary list writers forth scififantasy novel documenting journey trying get published maybe well list sometime,youtube
wasnt expecting favorite booksseries listed,youtube
well made case book must read might interested perusing,youtube
would go following particular order red rising agree first book thoroughly mediocre damn series take amazing ways golden son et al butchers crossing never imagined western could done without cowboys native americans williams pulls spectacularly evocative nature descriptions ever read hobbit basically perfect book far concerned even one known works english language starship troopers heinlein perhaps best scifi author two generations novel cause ponder thoughts persons role obligations within society given much focus america least rights entitled think worth askwhat owe society book demand promise ann weisgarber kind love story gritty messy comes unideal strings attached might like well catherine wainwright forced circumstance accept marriage proposal former suitor leaves uppercrust early dayton oh makes way galveston new husband owns reasonably successful dairy farm set backdrop one devastating storms ever hit gulf coast,youtube
damn dude like made list top books well minus piranesi decent nowhere near others imo,youtube
got pgs many couldnt,youtube
feel concerned fact recomended rising many friends fact caveat verbatim,youtube
fuck ive read,youtube
ive read except carl oops think blacktongue thief name wind well,youtube
sorry dnfd red rising series book great set pieces predictable plot guess qualify,youtube
dang nailed head,youtube
spot feels like im reading every rfantasy post repeating comments,youtube
need reread red rising something read praise remember liking im thinking maybe missed something didnt appreciate,youtube
denigrating brandon sanderson also including ddc list also aint book bro havent read robin hobb,youtube
im probably target audience ill save anyway recommendations amazing,youtube
im project hail mary wish could like writing good written like high school essay story interesting though,youtube
bros subscribe,youtube
soooo havent read hey recently bought piranesi ill read right finish vinland saga,youtube
ive read booki loved authors thriller books good,youtube
didi cute,youtube
favourite author isnt,youtube
also read book book wow,youtube
love book read definitely,youtube
spoiler girl name nora killed every women thought bad manipulating cheating amd father knew proud even mislead investigators,youtube
bro know devil disciple glenn meade kind kinda different plot twist crazyy,youtube
read,youtube
im totally obsessed freida macfaddan books first ever book freida macfaddan reason read freida macfaddan lot books spoiler alert killer known people guys,youtube
iss book par movie dekhi hain maine yehi story,youtube
saw video ordered book think got scammed please tell bought book one got like pages many supposed please tell got purchase,youtube
plot twist book mind blowing definitely read,youtube
im currently reading book,youtube
dadi please aap hindi banya karo video mujhe aapki video aachi lagati h par aap english banate ho,youtube
something like flicker dark stacy willingham,youtube
reads housemaids series freida became obsessed ordered books,youtube
read book amazing,youtube
prison prijon,youtube
based true story,youtube
buy book,youtube
wth,youtube
please hindi,youtube
behan hindi mai bol la,youtube
book like list like forever,youtube
prizon,youtube
feelings shes offlimits hes one cant resist love turns storm secrets desire heartbreak nothing stays one rule one mistake one unforgettable love fight feelings surrender feelings start reading theres turning back dare feel fire available webnovel,youtube
bought book days ago book fair locality im reading nowpray mental health,youtube
ive already read book trust fav book mean till end find thriller thriller great suspense end,youtube
hi read malnad mysteries,youtube
last short day,youtube
review book kdp indian author disappearance iris jameson angela charles,youtube
id rate book plot twist like magicians tricksurprising im still impressed,youtube
hii actually want ask u would twist silent patient u read mean twist silent patient ending kind abrupt mean dont really want twsit forcedkindly suggest,youtube
shocked days story guts read,youtube
searching u,youtube
girl,youtube
giving rosalind dyer,youtube
aloo khaoge,youtube
kinda giving naturals,youtube
appropriate year old,youtube
woww interesting man imagine watching old video im glad found,youtube
hi try reading alphabet killer prachi sharma may like,youtube
acting,youtube
avoided reading book night brooo,youtube
buy books cheap,youtube
hows girl glass case,youtube
read book loved loved end part book amazing,youtube
read book really surprised end read another book frieda mcfadden never lie book beyond everything plot twist end woww anyone reads comment suggest read book,youtube
hii yall ive finished never lie verity silent patient housemaid st one loving genre suggest mind boggling thrillers please,youtube
read dog god best book world,youtube
prizan,youtube
bro read book ur recommendation dude thank,youtube
poor taste seeone lamest thriller book ever read calling best,youtube
locked door,youtube
book awesome,youtube
meaannnuh little context,youtube
loved book encouraged read books,youtube
question please answer got spoiler door wasnt locked stucked way father killing door stucked came kill women know thought kiddish plot bcoz freidas books plots insane pls tell plot little close,youtube
could please tell us best horror books hindi language unable find proper recently bought one literally childish help thank,youtube
finished reading book morning verg good totally recommend adrenaline rush got match also check books author great writter,youtube
nice review,youtube
buy books,youtube
read worthy god ikshit gautami nice personal favourite,youtube
read book plss reply need know,youtube
prison prijann,youtube
please make video telling bit top fav thriller books,youtube
looks like jenifer winget,youtube
thank youuuuu suggestion video read book lit,youtube
scared horror,youtube
diiii suggest thriller books cause th class months break want read thriller brooks also romantic books parents wont allow please way year old please suggest thriller books romance book cover something something romantic budget friendly alsoplzzzzzzzzzzzzzzzzzzzzzzzzzzzzzzzzzzzz,youtube
read ending,youtube
read book got literal chills reading,youtube
similar one hindi web series called mussoorie,youtube
bruhh today found channel im addicted,youtube
like say story without spoilers would like next next love yaar,youtube
hey please tell us,youtube
please tell whole story,youtube
bahen soundtrack badle le aache ko nind naa aa payegi,youtube
theory reading maybe one killing dont know multiple personality disorder kinda thingy,youtube
buy new novel prajakta koli,youtube
getting goosebumps,youtube
please make fantasy book haul,youtube
hi sister read books free,youtube
ar talking flicker dark,youtube
read yesterday recommendation nice could better ive many questions regarding book want someone discuss,youtube
behan get life leave people read book,youtube
popped feed nowhere great,youtube
waiting one,youtube
kind giving good dead holly jackson last one agggtm series,youtube
try rock paper scissors alice feeny,youtube
nolan writes cid script instead shriram raghavan,youtube
hey read one us lying series cuz u havent need read series,youtube
book similar flicker dark kind legit,youtube
di ur name u r vey sweet helpful,youtube
lets book buddies read verity havent already,youtube
love mcfadden books best popcorn thrillers best unputdownable,youtube
main culprit kailashi dont know people dont highlight thathe topmost person blamed sudhas deathjust lust,youtube
please aap logon ne gunahon ka devta padh liya chandra ka jivan jise aap gunahon ka devta yah pata nahin kya mante ho lekin ab aap ek bar please rape ki machhali bhi upnyas padho jo unki khud ki patni ne apne vaivahik jivan per likha hua hai kanta bharati ji ne fir aapko gunahon ke devta se nafrat hone lagi chandra se nafrat hone lagi dharmveer bharati se bhi nafrat hone lagegi please ek bar aap log padhiye jarur,youtube
ret ki machhli padhna dharmavir bharti ka asli gnda chehra dikhta h,youtube
mene book khatam kari h pdkr par muje isme kisi ki koi galati nahi lagi siwaye iske ki agar chandar chahta uski mout itni bhayvah nirdayi n hoti,youtube
bhai mai upsc preparation kr rha hu aur meri pahli nobel gunaho ka devta pad raha hu mujhe itna dard ho raha h ki mai khud ko samhal nhi pa raha hu bahut dard hota h padne se,youtube
yr ye kitaab bhut slow hai kuch khas ni lgioverated,youtube
slow overated,youtube
lekin chandar devta thha hi nahi,youtube
sudha marne se pahile chander se cheekh k kyu kehti hai anyone explain story theres mention anyone going australia,youtube
pehle ret ke machhali padho phir tum upanniyas ke lekhak ko gali doge,youtube
ki teacher,youtube
multiple time heard bs wo payar kar baithata hai apne hi teacher ki beti se come man dont spread kind words please puri kitab mein na writer ne kabhi aisa kuch kehne ki kosis ki na kisi kirdar ne aisa kuch samajhne ki idiot use kind words chandar ke liye sudha ek premika se kahin upr thi aur sudha ke chandar devta se bhi upar,youtube
bhai teacher ki expectations bhi hai ki intercaste marriage nhi honi chahiye,youtube
also book hesitating read becoz hindi weak book really worth reading,youtube
bhai sirf ek prishth ptha hu book ka review dekhne youtube pr aa gya comments ptha ke meri himmat hi nhi ho rhi hai continue krne ki,youtube
hum sab kisi na kisi bojh tale jee rhe hai,youtube
sudha vinti ne milkr chandra ko devta bna diya jabki mene jb ise padha lga ki asal chandra devta nhi tha vo apne tyag pr ghamand kr betha asal sudha devi thi jisne apne jism ko sop diya lekin apni ruh nhi sop pai last usee vh virah rupi danav nigal gya,youtube
mujhe suru ke page lhtm karte hi samajh aagya ki sudha akhir asman mil jayegi n jane kyo ek ajeeb si tadap thi andar aisa lga sudha sayad meri si hai,youtube
aap kehte hain ki es prem mein aajadi di gai pr sudha ko bandha gya hai,youtube
chandar ko devta sirf kaha gya h balki chandar ko sab kuch maan krr uski puja krne wali sudha asli devi thi sudha ne apna sab kuch luta kr chandar ko devta mana tha sudha ne bataya ki prem sirf prem hota h na sharirik sukh na shaadi na hamesha ek saath rhna na kuch aur prem sirf prem hi h aur ek baar jisse ho gya marte dam tk ussi se rahega chahe shaadi kisi se bhi ho sudha ne apne pyar ko hamesha puja aur koi iccha nhi rakhi chandar duniya ki baaton phas gya aur apni devi ko hamesha k liye kho diya,youtube
kal mera exam tha ess upnivass ka,youtube
agar chandar sudha se sadi kr leta aaj sudha jinta hoti kaas uski jagah kailash mr jata sudha ki sadi chandar se ho jati,youtube
myjhe pahli bar hi sudha se pyar ho gaya,youtube
kya,youtube
dec ko uski shadi ho jayegi kisi ke sath plzz pray ki uski shadi na ho love,youtube
youtube gunaho ka devta swarnima bajpai,youtube
sudha ne apne aap ko puri trh chandra ko sop diya tha yhi uska,youtube
wo ek decision jis se usne sudha ko shadi ke liye mnaya,youtube
phool baat ka gawah h chandar ki tode wahi jate h jo achhe hote h,youtube
bjp ka tatta aagya bich,youtube
aaj mne pdha mere ansu nhi ruk rhe,youtube
sahi kaha aapne main bhi ye sun rhi ho episode par pauche hai ab,youtube
ek hu,youtube
kitab padhkar ro hi raha tha ab comment padhte padhte aankh bhar aaye kaash ki koi mere paas hota jinse apne dilo ki baat kah pata miss sudha mai chander hota samaj se lad jata tumhare liye aur itna nahi karta kam se kam tumhe shaadi karne ko majbur nahi karta akele tum hi lad leti hum jeet jaate par maine tumhe ladne bhi nahi diya im sorry sudha,youtube
bhaisaab abhii pad ke khtam kriii ab yhii yhii chal rhaa dimaag mee isi bajah se yese novel pdna avoid krtaa hoon,youtube
jab sudha apni shadi ka sun kar boht udas hone lagi toh mujhe pages skip karne pade aur jab laga ki kahani bigadti ja rhi h last page per aa gaya aur uske bad mera dil itna dukha mene dharmveer bharti ko bohot galiya di aur deta rahunga aur ab us book ko khone ki meri himmat nhi h,youtube
chandar ne kabhi sudha se pyar nahi kiya wo bs pammi se aakarshit thae,youtube
wanna read every comment comment section every line hits hard book,youtube
responsible deeds societyand ju st cover people try find escape inner soul make responsible societybut whole truth society us dead love innocene save really courage say actually,youtube
aap sabhi ek bar ret ki machali jaroor padhiyega,youtube
aise character jaisa dhila main nahin,youtube
kafi logo ne likha aakhri aasu nhi ruke mere aasu tabhi khatam hogye jab sudha ki shadi hui jab vo vapis aayi dam bimar halat uske marne tak meri aakhe jese thak si chuki thi aasu baha baha kar kabhi aakhri binti chandra ka vivah na hota dil bechen rheta story kafi bekar hojati hats dharmvir bharti unhone aakhri mr kafi kuch sikha diya,youtube
chandar full wo sudha ki puri life uske emotion control karta hai wo shadi nhi krna chahti lekin chandar ko apni mahanta dikhani hai sudha k pitaji ko ki sirf whi sudha ko mna sakta hai sudha ko thappad marna use bahut kuch sunana jb marzi aaye apne mn ka vyawhar karna chadar sirf gunahon ka putla tha jisne apne mahanta k swarth bholi si sudha ki bali chada di sudha mari nhi uski hatya ki gyiuse til mara gya aur uske marne ke baad besharmi se binti se shadi bhi kr leta hai waah devta,youtube
ek bar ise padh liye fir kabhi padhne k himmat nhi hui,youtube
ret ki machhli padhoo tab samjh ayega dharam veer bharti ki sachai,youtube
hits different,youtube
ye th class main te,youtube
pta nahi q muje sudha shuru se hi galat lgi prem dono pr iska sara bojh chandar ne uthaya shadi k baad bi na sudha aage bdi na usne chandar ko aage badhne diya chahti toh vo vidroh kr skti thi keval iska bojh apni chidhiyon k madhyam se vo hmesha chandar pr dalti rahi usne chandar ko kisi se shadi k liye b tb kaha jb use apni sehat thik na lagi agar vo thik rehti toh tb vo chandar ko sara jivan ek galani k bojh daal k rkhti,youtube
kuch nhi bdla hai aaj tk aaj bhi kai asi sudha hai jo chandr se alg ho jati hai hmari society ki soch,youtube
maine kai dino se padhna shuru aaj khatam kiya hoon mera rooh kaam gya bhai sir dard hone laga ishe padh mat kahunga na padho ish book ko,youtube
ret ki machhli padho say,youtube
mene first time novel padhi ise padh padh kr itna ronaa aaya mene ye kal hi morning khatam ki h mujhe poori raat neend nhi aayi honestly speaking ye book bahut hi achi h,youtube
english translation book,youtube
reading ret ke machli somehow hate real life,youtube
bahut hi behtreen story hai iss book ki,youtube
acche dost life se chale jana iske piche bhi koi reason hai kya,youtube
chandar k mood swings hi khatam nhi hote,youtube
chandar always dillema idea love sex ignoring individuality sudhas pure immense love tried mend beliefs genralization women suited fell firm beliefs regained heartwretching event sudhas death atone sins good deed devta fulfill sudhas last wish marrying binti,youtube
aisi love story pr movies kyu nhi banti,youtube
essa pavitra prem ham aaj k zamane expect kar skte h,youtube
toxic af,youtube
completing feeling lonely first last book dont feel like reading heart hurting lot,youtube
chandar swarthi insaan h use jab oita ki zarurt hoti h dr shukla k pass jata h jab dular ki zarurat hoti h sudha k pass jab flert krna ho binti k pass vasna mitane pammi k pass ha vo devta h par gunaho ka,youtube
sir aap na dr benjamin louis ki trh lag rahe ho ek movie hai anjaampathira south ki bahut achhi hai usi ek character hai drbenjamij louis hai,youtube
book ka link plz,youtube
ye book maine audiobook suni thi aur itna depressed feel ho raha tha heart heaviness aur aanshu ruk nahi rahe thejab bhi sochti hun book k bare seham jati hunshayad horror book bhi itni horror nahi ho sakti,youtube
sudha ka dukh kya km tha toh gaisu ki zindagi bhi jite jii narak ban gyi ek thi jisne shaadi k khoob sapne dekhe dusri ne shaadi naa krne k aur hua kuch aisa ki dono ki zindagi ne adla badli ki lekin dukh ek hi mila aur vo tha mnchaha pyar ka na milna,youtube
bhaiya full respect u ye nhi bolna tha ki sudha kyuki shyad ye bata dena bilkul baisa hi h jaise kisi cricket stadium match dekhna sath pata hona ki match ye team jeetni h known aap pehle bol rhe h ki ye spoiler alert h pls jinhone ye book nhi padi hai,youtube
recommend everyone read book listen mohrafi kishor kumars album definitely connect every line novel one song ae dil mushkil like agree,youtube
parivar keliye koi kam kaj nahi free hoto pdho nhi parivar bachche sang khush raho bhartiy snskruti ke dhrm pustk pdho baaki free keliye kuchh bhi koi kaam nhi,youtube
sem hear,youtube
mereko maza nahi aya,youtube
ret ki machli,youtube
recommendation read powerless triologyits good,youtube
ha,youtube
east eden stoner,youtube
upon broken heart would best,youtube
